schoolName,boardName,schoolLevel,avgScore
"St. Gabriel Elementary School","Ottawa CSB","Elementary",95
"Stephen Leacock Public School","Ottawa-Carleton DSB","Elementary",95
"St. Isabel Catholic Elementary School","Ottawa CSB","Elementary",93
"École élémentaire catholique George-Étienne-Cartier","CSDC du Centre-Est de l'Ontario","Elementary",92
"École élémentaire catholique Jean-Robert-Gauthier","CSDC du Centre-Est de l'Ontario","Elementary",92
"École élémentaire catholique Coeur d'Ottawa","CSDC du Centre-Est de l'Ontario","Elementary",91
"W. Erskine Johnston Public School","Ottawa-Carleton DSB","Elementary",91
"École élémentaire catholique d'enseignement personnalisé Édouard-Bond","CSDC du Centre-Est de l'Ontario","Elementary",89
"École élémentaire publique Séraphin-Marion","CÉP de l'Est de l'Ontario","Elementary",89
"First Avenue Public School","Ottawa-Carleton DSB","Elementary",89
"École élémentaire publique Charlotte Lemieux","CÉP de l'Est de l'Ontario","Elementary",88
"St Luke (Nepean) Elementary School","Ottawa CSB","Elementary",88
"Elmdale Public School","Ottawa-Carleton DSB","Elementary",88
"Hopewell Avenue Public School","Ottawa-Carleton DSB","Elementary",88
"Knoxdale Public School","Ottawa-Carleton DSB","Elementary",88
"St Anne Elementary School","Ottawa CSB","Elementary",87
"Colonel By Secondary School","Ottawa-Carleton DSB","Secondary",87
"École secondaire catholique Paul-Desmarais","CSDC du Centre-Est de l'Ontario","Secondary",86
"École élémentaire publique Francojeunesse","CÉP de l'Est de l'Ontario","Elementary",86
"Chapel Hill Catholic Elementary School","Ottawa CSB","Elementary",86
"St James Elementary School","Ottawa CSB","Elementary",86
"St. Stephen Catholic Elementary School","Ottawa CSB","Elementary",86
"Kanata Highlands Public School","Ottawa-Carleton DSB","Elementary",86
"École élémentaire publique Louise-Arbour","CÉP de l'Est de l'Ontario","Elementary",85
"Convent Glen Catholic Elementary School","Ottawa CSB","Elementary",85
"St. Brother Andre Elementary School","Ottawa CSB","Elementary",85
"St. Gemma Elementary School","Ottawa CSB","Elementary",85
"Earl of March Secondary School","Ottawa-Carleton DSB","Secondary",85
"St. Benedict Elementary School","Ottawa CSB","Elementary",84
"St. Cecilia Catholic School","Ottawa CSB","Elementary",84
"W.O. Mitchell Elementary School","Ottawa-Carleton DSB","Elementary",84
"École élémentaire catholique Bernard-Grandmaître","CSDC du Centre-Est de l'Ontario","Elementary",83
"École élémentaire publique Michel-Dupuis","CÉP de l'Est de l'Ontario","Elementary",83
"Sacred Heart High School","Ottawa CSB","Secondary",83
"Agincourt Road Public School","Ottawa-Carleton DSB","Elementary",83
"Broadview Public School","Ottawa-Carleton DSB","Elementary",83
"Lakeview Public School","Ottawa-Carleton DSB","Elementary",83
"Mutchmor Public School","Ottawa-Carleton DSB","Elementary",83
"Orleans Wood Elementary School","Ottawa-Carleton DSB","Elementary",83
"École élémentaire catholique Saint-François-d'Assise","CSDC du Centre-Est de l'Ontario","Elementary",82
"École élémentaire catholique d'enseignement personnalisé Lamoureux","CSDC du Centre-Est de l'Ontario","Elementary",82
"St Jerome Elementary School","Ottawa CSB","Elementary",82
"Castor Valley Elementary School","Ottawa-Carleton DSB","Elementary",82
"Maple Ridge Elementary School","Ottawa-Carleton DSB","Elementary",82
"Merivale High School","Ottawa-Carleton DSB","Secondary",82
"Nepean High School","Ottawa-Carleton DSB","Secondary",82
"Rockcliffe Park Public School","Ottawa-Carleton DSB","Elementary",82
"Roland Michener Public School","Ottawa-Carleton DSB","Elementary",82
"St Elizabeth Ann Seton Elementary School","Ottawa CSB","Elementary",81
"St Emily (Elementary) Separate School","Ottawa CSB","Elementary",81
"Roch Carrier Elementary School","Ottawa-Carleton DSB","Elementary",81
"West Carleton Secondary School","Ottawa-Carleton DSB","Secondary",81
"École secondaire catholique Samuel-Genest","CSDC du Centre-Est de l'Ontario","Secondary",80
"École élémentaire catholique Montfort","CSDC du Centre-Est de l'Ontario","Elementary",80
"École élémentaire catholique Terre-des-Jeunes","CSDC du Centre-Est de l'Ontario","Elementary",80
"All Saints Catholic High School","Ottawa CSB","Secondary",80
"Guardian Angels Elementary School","Ottawa CSB","Elementary",80
"Canterbury High School","Ottawa-Carleton DSB","Secondary",80
"Connaught Public School","Ottawa-Carleton DSB","Elementary",80
"Lisgar Collegiate Institute","Ottawa-Carleton DSB","Secondary",80
"Sir Winston Churchill Public School","Ottawa-Carleton DSB","Elementary",80
"Woodroffe Avenue Public School","Ottawa-Carleton DSB","Elementary",80
"École secondaire catholique de l’innovation","CSDC du Centre-Est de l'Ontario","Secondary",79
"École élémentaire catholique Sainte-Kateri","CSDC du Centre-Est de l'Ontario","Elementary",79
"Holy Spirit Elementary School","Ottawa CSB","Elementary",79
"St Isidore Elementary School","Ottawa CSB","Elementary",79
"St. Bernadette Catholic Elementary School","Ottawa CSB","Elementary",79
"Manotick Public School","Ottawa-Carleton DSB","Elementary",79
"École élémentaire catholique Notre-Dame-des-Champs","CSDC du Centre-Est de l'Ontario","Elementary",78
"École secondaire publique De La Salle","CÉP de l'Est de l'Ontario","Secondary",78
"St George Elementary School","Ottawa CSB","Elementary",78
"St John the Apostle Elementary School","Ottawa CSB","Elementary",78
"Glebe Collegiate Institute","Ottawa-Carleton DSB","Secondary",78
"École secondaire catholique Franco-Cité","CSDC du Centre-Est de l'Ontario","Secondary",77
"École secondaire publique L'Alternative","CÉP de l'Est de l'Ontario","Secondary",77
"St Francis of Assisi Elementary School","Ottawa CSB","Elementary",77
"St Joseph High School","Ottawa CSB","Secondary",77
"St. Mother Teresa High School","Ottawa CSB","Secondary",77
"A.Y. Jackson Secondary School","Ottawa-Carleton DSB","Secondary",77
"St Andrew Elementary School","Ottawa CSB","Elementary",76
"St. Dominic Catholic Elementary School","Ottawa CSB","Elementary",76
"Chapman Mills Elementary School","Ottawa-Carleton DSB","Elementary",76
"Devonshire Community Public School","Ottawa-Carleton DSB","Elementary",76
"Jack Donohue Public School","Ottawa-Carleton DSB","Elementary",76
"North Gower/Marlborough Public School","Ottawa-Carleton DSB","Elementary",76
"Assumption Catholic Elementary School","Ottawa CSB","Elementary",75
"Corpus Christi Catholic Elementary School","Ottawa CSB","Elementary",75
"Holy Trinity Catholic High School","Ottawa CSB","Secondary",75
"St Gregory Elementary School","Ottawa CSB","Elementary",75
"St Mark High School","Ottawa CSB","Secondary",75
"St Patrick Elementary School","Ottawa CSB","Elementary",75
"St. Juan Diego Catholic Elementary School","Ottawa CSB","Elementary",75
"A. Lorne Cassidy Elementary School","Ottawa-Carleton DSB","Elementary",75
"Barrhaven Public School","Ottawa-Carleton DSB","Elementary",75
"Bayview Public School","Ottawa-Carleton DSB","Elementary",75
"Elgin Street Public School","Ottawa-Carleton DSB","Elementary",75
"Hilson Avenue Public School","Ottawa-Carleton DSB","Elementary",75
"Mary Honeywell Elementary School","Ottawa-Carleton DSB","Elementary",75
"Westwind Public School","Ottawa-Carleton DSB","Elementary",75
"St Michael (Fitzroy) Elementary School","Ottawa CSB","Elementary",74
"St. Francis Xavier (9-12) Catholic School","Ottawa CSB","Secondary",74
"Longfields Davidson Heights Secondary School","Ottawa-Carleton DSB","Secondary",74
"École élémentaire catholique Sainte-Geneviève","CSDC du Centre-Est de l'Ontario","Elementary",73
"Holy Cross Elementary School","Ottawa CSB","Elementary",73
"St Leonard Elementary School","Ottawa CSB","Elementary",73
"St Marguerite d'Youville Elementary School","Ottawa CSB","Elementary",73
"St Theresa Elementary School","Ottawa CSB","Elementary",73
"Berrigan Elementary School","Ottawa-Carleton DSB","Elementary",73
"John McCrae Secondary School","Ottawa-Carleton DSB","Secondary",73
"South March Public School","Ottawa-Carleton DSB","Elementary",73
"Steve MacLean Public School","Ottawa-Carleton DSB","Elementary",73
"Terry Fox Elementary School","Ottawa-Carleton DSB","Elementary",73
"Holy Redeemer Elementary School","Ottawa CSB","Elementary",72
"St Philip Elementary School","Ottawa CSB","Elementary",72
"Lady Evelyn Alternative School","Ottawa-Carleton DSB","Elementary",72
"Pleasant Park Public School","Ottawa-Carleton DSB","Elementary",72
"Richmond Public School","Ottawa-Carleton DSB","Elementary",72
"Our Lady of Peace Elementary School","Ottawa CSB","Elementary",71
"St Martin de Porres Elementary School","Ottawa CSB","Elementary",71
"St Mary (Gloucester) Elementary School","Ottawa CSB","Elementary",71
"St Matthew High School","Ottawa CSB","Secondary",71
"St Monica Elementary School","Ottawa CSB","Elementary",71
"Churchill Alternative School","Ottawa-Carleton DSB","Elementary",71
"Heritage Public School","Ottawa-Carleton DSB","Elementary",71
"Kars on the Rideau Public School","Ottawa-Carleton DSB","Elementary",71
"Monsignor Paul Baxter Elementary School","Ottawa CSB","Elementary",70
"St Peter High School","Ottawa CSB","Secondary",70
"Adrienne Clarkson Elementary School","Ottawa-Carleton DSB","Elementary",70
"Fallingbrook Community Elementary School","Ottawa-Carleton DSB","Elementary",70
"Half Moon Bay Public School","Ottawa-Carleton DSB","Elementary",70
"St Pius X High School","Ottawa CSB","Secondary",69
"St. Kateri Tekakwitha Elementary School","Ottawa CSB","Elementary",69
"Bridlewood Community Elementary School","Ottawa-Carleton DSB","Elementary",69
"Glen Ogilvie Public School","Ottawa-Carleton DSB","Elementary",69
"École élémentaire publique Marie-Curie","CÉP de l'Est de l'Ontario","Elementary",68
"Georges Vanier Catholic Elementary School","Ottawa CSB","Elementary",68
"Immaculata High School","Ottawa CSB","Secondary",68
"Castlefrank Elementary School","Ottawa-Carleton DSB","Elementary",68
"South Carleton High School","Ottawa-Carleton DSB","Secondary",68
"Summerside Public School","Ottawa-Carleton DSB","Elementary",68
"Wazoson Public School","Ottawa-Carleton DSB","Elementary",68
"École élémentaire catholique Marius-Barbeau","CSDC du Centre-Est de l'Ontario","Elementary",67
"St Bernard Elementary School","Ottawa CSB","Elementary",67
"St Thomas More Elementary School","Ottawa CSB","Elementary",67
"St. John XXIII Elementary School","Ottawa CSB","Elementary",67
"St. Rose of Lima Elementary School","Ottawa CSB","Elementary",67
"Alta Vista Public School","Ottawa-Carleton DSB","Elementary",67
"Farley Mowat Public School","Ottawa-Carleton DSB","Elementary",67
"Forest Valley Elementary School","Ottawa-Carleton DSB","Elementary",67
"Severn Avenue Public School","Ottawa-Carleton DSB","Elementary",67
"Sir Wilfrid Laurier Secondary School","Ottawa-Carleton DSB","Secondary",67
"Vincent Massey Public School","Ottawa-Carleton DSB","Elementary",67
"École secondaire publique Omer-Deslauriers","CÉP de l'Est de l'Ontario","Secondary",66
"St Clare Elementary School","Ottawa CSB","Elementary",66
"St Paul High School","Ottawa CSB","Secondary",66
"St Rita Elementary School","Ottawa CSB","Elementary",66
"Thomas D'Arcy McGee Elementary School","Ottawa CSB","Elementary",66
"Cairine Wilson Secondary School","Ottawa-Carleton DSB","Secondary",66
"Goulbourn Middle School","Ottawa-Carleton DSB","Elementary",66
"Huntley Centennial Public School","Ottawa-Carleton DSB","Elementary",66
"Osgoode Public School","Ottawa-Carleton DSB","Elementary",66
"Sir Robert Borden High School","Ottawa-Carleton DSB","Secondary",66
"Stonecrest Elementary School","Ottawa-Carleton DSB","Elementary",66
"Viscount Alexander Public School","Ottawa-Carleton DSB","Elementary",66
"Divine Infant Catholic Elementary School","Ottawa CSB","Elementary",65
"Briargreen Public School","Ottawa-Carleton DSB","Elementary",65
"Emily Carr Middle School","Ottawa-Carleton DSB","Elementary",65
"Fielding Drive Public School","Ottawa-Carleton DSB","Elementary",65
"Osgoode Township High School","Ottawa-Carleton DSB","Secondary",65
"St Michael (Corkery) Elementary School","Ottawa CSB","Elementary",64
"John Young Elementary School","Ottawa-Carleton DSB","Elementary",64
"Stittsville Public School","Ottawa-Carleton DSB","Elementary",64
"École élémentaire catholique Sainte-Anne","CSDC du Centre-Est de l'Ontario","Elementary",63
"Our Lady of Wisdom Elementary School","Ottawa CSB","Elementary",63
"St Augustine Elementary School","Ottawa CSB","Elementary",63
"St Catherine Elementary School","Ottawa CSB","Elementary",63
"St. John Paul II Elementary School","Ottawa CSB","Elementary",63
"Henry Larsen Elementary School","Ottawa-Carleton DSB","Elementary",63
"Katimavik Elementary School","Ottawa-Carleton DSB","Elementary",63
"Robert Hopkins Public School","Ottawa-Carleton DSB","Elementary",63
"Trillium Elementary School","Ottawa-Carleton DSB","Elementary",63
"St Elizabeth Elementary School","Ottawa CSB","Elementary",62
"Le Phare Elementary School","Ottawa-Carleton DSB","Elementary",62
"Roberta Bondar Public School","Ottawa-Carleton DSB","Elementary",61
"Vimy Ridge Public School","Ottawa-Carleton DSB","Elementary",61
"Holy Family Elementary School","Ottawa CSB","Elementary",60
"Notre Dame High School","Ottawa CSB","Secondary",60
"Bell High School","Ottawa-Carleton DSB","Secondary",60
"Greely Elementary School","Ottawa-Carleton DSB","Elementary",60
"Henry Munro Middle School","Ottawa-Carleton DSB","Elementary",60
"Hillcrest High School","Ottawa-Carleton DSB","Secondary",60
"Jockvale Elementary School","Ottawa-Carleton DSB","Elementary",60
"Shingwàkons Public School","Ottawa-Carleton DSB","Elementary",60
"Woodroffe High School","Ottawa-Carleton DSB","Secondary",60
"York Street Public School","Ottawa-Carleton DSB","Elementary",60
"Dr F J McDonald Catholic Elementary School","Ottawa CSB","Elementary",59
"Lester B Pearson Catholic High School","Ottawa CSB","Secondary",59
"St Anthony Elementary School","Ottawa CSB","Elementary",59
"D. Roy Kennedy Public School","Ottawa-Carleton DSB","Elementary",59
"W.E. Gowling Public School","Ottawa-Carleton DSB","Elementary",59
"Avalon Public School","Ottawa-Carleton DSB","Elementary",58
"St Patrick's High School","Ottawa CSB","Secondary",57
"General Vanier Public School","Ottawa-Carleton DSB","Elementary",57
"Manor Park Public School","Ottawa-Carleton DSB","Elementary",57
"Bells Corners Public School","Ottawa-Carleton DSB","Elementary",56
"Centennial Public School","Ottawa-Carleton DSB","Elementary",55
"Dunning-Foubert Elementary School","Ottawa-Carleton DSB","Elementary",55
"Good Shepherd Elementary School","Ottawa CSB","Elementary",54
"Our Lady of Fatima Elementary School","Ottawa CSB","Elementary",54
"St Daniel Elementary School","Ottawa CSB","Elementary",52
"Sawmill Creek Elementary School","Ottawa-Carleton DSB","Elementary",52
"Prince of Peace Elementary School","Ottawa CSB","Elementary",50
"Brookfield High School","Ottawa-Carleton DSB","Secondary",50
"Cambridge Street Community Public School","Ottawa-Carleton DSB","Elementary",50
"St Luke (Ottawa) Elementary School","Ottawa CSB","Elementary",49
"Dunlop Public School","Ottawa-Carleton DSB","Elementary",49
"Queen Elizabeth Public School","Ottawa-Carleton DSB","Elementary",48
"St Brigid Elementary School","Ottawa CSB","Elementary",47
"Manordale Public School","Ottawa-Carleton DSB","Elementary",47
"Our Lady of Victory Elementary School","Ottawa CSB","Elementary",46
"Meadowlands Public School","Ottawa-Carleton DSB","Elementary",45
"Robert Bateman Public School","Ottawa-Carleton DSB","Elementary",45
"Our Lady of Mount Carmel Elementary School","Ottawa CSB","Elementary",43
"Bayshore Public School","Ottawa-Carleton DSB","Elementary",43
"Gloucester High School","Ottawa-Carleton DSB","Secondary",43
"Pinecrest Public School","Ottawa-Carleton DSB","Elementary",42
"Regina Street Alternative School","Ottawa-Carleton DSB","Elementary",42
"Riverview Alternative School","Ottawa-Carleton DSB","Elementary",42
"Ridgemont High School","Ottawa-Carleton DSB","Secondary",41
"Featherston Drive Public School","Ottawa-Carleton DSB","Elementary",40
"Charles H. Hulse Public School","Ottawa-Carleton DSB","Elementary",39
"St Michael Elementary School","Ottawa CSB","Elementary",37
"Metcalfe Public School","Ottawa-Carleton DSB","Elementary",36
"Sir Guy Carleton Secondary School","Ottawa-Carleton DSB","Secondary",35
"Convent Glen Elementary School","Ottawa-Carleton DSB","Elementary",33
"Carleton Heights Public School","Ottawa-Carleton DSB","Elementary",32
"Robert E.  Wilson Public School","Ottawa-Carleton DSB","Elementary",32
"Arch Street Public School","Ottawa-Carleton DSB","Elementary",31
"Queen Mary Street Public School","Ottawa-Carleton DSB","Elementary",30
"Blossom Park Public School","Ottawa-Carleton DSB","Elementary",29
"Hawthorne Public School","Ottawa-Carleton DSB","Elementary",26
"Carson Grove Elementary School","Ottawa-Carleton DSB","Elementary",19
"Ottawa Technical Secondary School","Ottawa-Carleton DSB","Secondary",17
"Adult High School","Ottawa-Carleton DSB","Secondary",10