id,name,area,image,medianIncome,avgRent,avgHomePrice,pros,cons
the-glebe,The Glebe,Central Ottawa,/neighbourhoodcovers/the-glebe-spotlight-w.jpg,89000,2150,1198947,Excellent walkability; Great local shops on Bank St; Beautiful parks; Strong community feel,Higher rent prices; Limited parking; Busy on weekends
old-ottawa-east,Old Ottawa East,Central Ottawa,/neighbourhoodcovers/oldottawaeast.avif,82000,1900,930000,Canal and river access; Quiet residential streets; Near downtown; Main Street village feel,Limited shopping options; Some construction; Smaller neighbourhood
westboro,Westboro,West End,/neighbourhoodcovers/WESTBORO-RICHMOND-ROAD-STRIP.jpg,87469,2200,930315,Near Ottawa River paths; Great cafes and boutiques; LRT access; Active lifestyle friendly,Getting expensive; Crowded in summer; Limited nightlife
byward-market,Byward Market,Downtown,/neighbourhoodcovers/byward.jpg,59597,1950,500000,Best nightlife in Ottawa; Farmers market; Walking distance to everything; Historic architecture,Noisy at night; Safety concerns late evening; Tourist crowds
centretown,Centretown,Downtown,/neighbourhoodcovers/centretown.webp,64949,1755,501560,Central location; Diverse food scene; Great transit; Affordable for downtown,Street noise; Older buildings; Less green space
old-ottawa-south,Old Ottawa South,South End,/neighbourhoodcovers/old ottawa south.webp,125000,2275,1100000,Canal access; Quiet residential streets; Great for families; Beautiful heritage homes,Limited shopping; Higher home prices; Less nightlife
riverside-park,Riverside Park,South End,/neighbourhoodcovers/riversidepark.jpg,73000,1750,600000,Near Mooney's Bay; Beach access; Affordable; Good park space,Some aging housing; Less walkable; Industrial areas nearby
hintonburg,Hintonburg,West End,/neighbourhoodcovers/hintonburg.jpeg,67500,2000,675600,Local art scene; Great brunch spots; LRT station; Gentrifying rapidly,Gentrification concerns; Some rough patches; Parking challenges
wellington-village,Wellington Village,Central,/neighbourhoodcovers/wellingtonvillage.png,120000,1850,639273,Trendy shops and cafes; Near Westboro; Great parks; Family friendly,Expensive; Limited parking; Busy streets
kanata,Kanata,Suburban West,/neighbourhoodcovers/kanata.webp,104103,2400,850000,Tech job opportunities; Great schools; Safe for families; Modern amenities,Car dependent; Far from downtown; Less character
stittsville,Stittsville,Suburban West,/neighbourhoodcovers/stittsville-sign.jpg,114677,2250,764223,Growing community; Family friendly; New developments; Good schools,Car essential; Far from downtown; Limited transit
alta-vista,Alta Vista,South East,/neighbourhoodcovers/altavistanewimage.webp,71178,1850,733415,Established neighbourhood; Near hospital; Good schools; Mature landscaping,Aging infrastructure; Limited nightlife; Needs car for most trips
sandy-hill,Sandy Hill,Central,/neighbourhoodcovers/Sandy-Hill-Stewart-Street-resize-e1594484163945.jpg,60561,1800,558092,Affordable rent; Near uOttawa; Walkable to downtown; Diverse community,Student party noise; Variable maintenance; Safety at night
orleans,Orleans,East End,/neighbourhoodcovers/orleans.webp,100589,2200,700000,Affordable housing; Strong Franco-Ontarian culture; New developments; Family oriented,Long commute downtown; Suburban sprawl; Less walkable
barrhaven,Barrhaven,South Suburban,/neighbourhoodcovers/barrhaven.webp,104863,2385,748553,New construction; Very safe; Good value homes; Family amenities,Far from core; Car essential; Cookie-cutter homes
bayshore,Bayshore,West End,/neighbourhoodcovers/Bayshore_Shopping_Ctr.jpg,68812,2000,439190,LRT access; Shopping centres; Affordable,Less character; Traffic congestion
bells-corners,Bells Corners,West End,/neighbourhoodcovers/bells-corners-greenbelt-1.jpg,81818,1800,551607,Affordable; Good schools; Community feel,Car dependent; Far from downtown
carlington,Carlington,Central West,/neighbourhoodcovers/carlington.jpeg,69838,1700,600000,Central location; Affordable; Near Carleton U,Some rough areas; Aging housing stock
hunt-club,Hunt Club,South End,/neighbourhoodcovers/huntclub.webp,89664,1750,714238,Good schools; Shopping access; Family friendly,Car required; Suburban sprawl
riverside-south,Riverside South,South Suburban,/neighbourhoodcovers/riverside south.jpg,115319,2200,754416,New development; Very safe; Growing amenities,Long commute; Limited transit
manotick,Manotick,Rural South,/neighbourhoodcovers/manotick.jpeg,128000,2500,1120987,Village charm; Rideau River; Very safe,Car essential; Limited services
vars,Vars-Navan,Rural East,/neighbourhoodcovers/vars.jpg,98314,1800,650000,Rural lifestyle; Affordable land; Quiet,Very car dependent; Limited amenities
carp,Carp,Rural West,/neighbourhoodcovers/carp.jpg,121504,2000,787000,Carp Fair; Village atmosphere; Nature access,Remote; Limited transit
constance-bay,Constance Bay,Rural West,/neighbourhoodcovers/constance bay.jpg,92682,2200,720000,Waterfront living; Beach access; Peaceful,Very remote; Flood risk areas
richmond,Richmond,Rural West,/neighbourhoodcovers/richmond.jpg,108071,1900,737064,Historic village; Community events; Growing,Far from city; Limited shopping
metcalfe,Metcalfe-Osgoode,Rural South,/neighbourhoodcovers/metcalfe.jpeg,105515,1700,853000,Farmland views; Quiet living; Affordable,Very rural; Long commute
nepean,Nepean,South West,/neighbourhoodcovers/nepean.jpeg,89983,2000,680000,Established area; Good schools; Shopping,Car helpful; Some traffic
merivale,Merivale,South West,/neighbourhoodcovers/merivale.avif,83566,1900,650000,Good shopping access; Established community; Central location,Car dependent; Some older housing
vanier,Vanier,Central East,/neighbourhoodcovers/vanier.webp,56152,2012,478375,Very walkable; Affordable; Diverse community,Safety concerns; Some rough areas
new-edinburgh,New Edinburgh,Central East,/neighbourhoodcovers/new edinburg.jpeg,87672,2400,895774,Historic charm; Near Rideau Hall; River access,Very expensive; Limited parking
cyrville,Cyrville,East End,/neighbourhoodcovers/cyrville.jpg,78000,1500,424000,Affordable condos; Near OC Transpo hub; LRT access; Industrial employment,Mostly industrial; Limited residential; Noise from highway
findlay-creek,Findlay Creek,South Suburban,/neighbourhoodcovers/findlaycreekstone.jpg,111000,2800,750000,New family-friendly community; Wide streets; Good schools; Safe neighbourhood,Limited transit (one bus); Far from downtown; Car essential
greely,Greely,Rural South,/neighbourhoodcovers/greely.jpeg,128000,2400,1000000,Rural charm; Large lots; Safe family community; Near Manotick Village,Very car dependent; No transit; Long commute; Limited services
north-gower,North Gower,Rural South,/neighbourhoodcovers/northgower.jpg,108000,2000,750000,Historic village charm; Farmland views; Quiet rural living; Strong community,Very car dependent; No transit; Limited amenities; Long commute
dunrobin,Dunrobin,Rural West,/neighbourhoodcovers/dunrobin.jpg,123000,2200,850000,Ottawa River access; Large rural lots; Quiet living; Nature trails,Very car dependent; No transit; Limited services; Long commute
belair-heights,Bel Air Heights,South West,/neighbourhoodcovers/belairheights.webp,79500,1900,650000,Established neighbourhood; Near Algonquin College; Good bus routes; Affordable,Some aging housing; Car helpful for errands
cumberland,Cumberland,East End,/neighbourhoodcovers/Cumberland_Ottawa.jpeg,125000,2100,750000,Historic village charm; Ottawa River access; Peaceful rural setting; Strong community,Very car dependent; Far from downtown; Limited transit; Limited shopping
kinburn,Kinburn,Rural West,/neighbourhoodcovers/kinburn.jpg,108000,1900,700000,Rural village charm; Near Carp; Quiet country living; Strong community,Very car dependent; No transit; Limited services; Long commute
munster-ashton,Munster-Ashton,Rural West,/neighbourhoodcovers/munster-aston.avif,106000,1800,680000,Rural countryside; Near Richmond; Peaceful farmland setting; Affordable,Very car dependent; No transit; Limited amenities; Long commute
corkery,Corkery,Rural West,/neighbourhoodcovers/corkery.jpg,124000,1900,750000,Rural countryside; Near Carp; Quiet farmland living; Large lots,Very car dependent; No transit; Limited services; Long commute
blackburn-hamlet,Blackburn Hamlet,East End,/neighbourhoodcovers/blackburn hamlet.jpg,90000,2100,562500,Established community; Good schools; Family friendly; Near Greenbelt,Car dependent; Far from downtown; Limited transit
gloucester,Gloucester,East End,/neighbourhoodcovers/gloucester.jpg,83000,1900,550000,Established community; Near Greenbelt; Good schools; Family friendly,Car dependent; Some aging housing; Far from downtown
fitzroy,Fitzroy,Rural West,/neighbourhoodcovers/Fitzroy_Harbour.jpg,95000,1800,650000,Close to rural amenities;Beautiful countryside;Large properties,Far from urban amenities;Limited transit;Long commute to downtown
